nama_produk,jenis_produk,harga_retail,harga_diskon,rating
Rock Flip Cover for Apple iPad Mini Retina,"[""Mobiles & Accessories >> Tablet Accessories >> Cases & Covers >> Rock Cases & Covers""]",1699.0,1199.0,4.3
Zwart GURNER 25 L Medium Laptop Backpack,"[""Bags, Wallets & Belts >> Bags >> Backpacks >> Zwart Backpacks""]",1200.0,492.0,4.2
Remington Body Hair BHT6100 Trimmer For Men,"[""Health & Personal Care Appliances >> Personal Care Appliances >> Trimmers""]",2495.0,1996.0,4.5
President Pyramid,"[""Sports & Fitness >> Outdoor & Adventure >> Camping & Hiking >> Camping & Hiking Bags & Packs >> President Camping & Hiking Bags & Packs""]",1349.0,899.0,3.9
Rock Book Cover for Samsung Galaxy Note 8.0 N5100,"[""Mobiles & Accessories >> Tablet Accessories >> Cases & Covers >> Rock Cases & Covers""]",1599.0,1199.0,4.7
Rock Flip Cover for iPad Air,"[""Mobiles & Accessories >> Tablet Accessories >> Cases & Covers >> Rock Cases & Covers""]",1999.0,1499.0,3.0
Ratnam Gold Diamond 18 K Ring,"[""Jewellery >> Rings""]",49999.0,43950.0,5.0
Folklore Solid Women's A-line Skirt,"[""Clothing >> Women's Clothing >> Western Wear >> Dresses & Skirts >> Skirts >> Folklore Skirts""]",699.0,349.0,4.0
HoA Baby Nappy Set of 6 - Plain Pure Cotton - Assorted,"[""Baby Care >> Diapering & Potty Training >> Nappies & Cloth Diapers >> HoA Nappies & Cloth Diapers""]",399.0,199.0,2.0
Rock Flip Cover for Tab S 8.4,"[""Mobiles & Accessories >> Tablet Accessories >> Cases & Covers >> Rock Cases & Covers""]",1499.0,1369.0,1.0
XQ Chevrolet Camaro,"[""Toys & School Supplies >> Remote Control Toys >> XQ Remote Control Toys""]",2399.0,2399.0,3.9
Kemei Body Groomer KM-30005 Trimmer For Men,"[""Health & Personal Care Appliances >> Personal Care Appliances >> Trimmers""]",899.0,349.0,5.0
Capdase Flip Cover for Apple iPad Mini / iPad Mini Retina Display,"[""Mobiles & Accessories >> Tablet Accessories >> Cases & Covers >> Capdase Cases & Covers""]",2199.0,1099.0,3.7
United Bags G Checks 35 L Medium Laptop Backpack,"[""Bags, Wallets & Belts >> Bags >> Backpacks >> United Bags Backpacks""]",1999.0,599.0,2.2
Dicapac Grip Back Cover for Galaxy Note,"[""Mobiles & Accessories >> Tablet Accessories >> Cases & Covers >> Dicapac Cases & Covers""]",1490.0,1350.0,4.0
Dhrohar Red 72 cm Table Runner,"[""Home Furnishing >> Kitchen & Dining Linen >> Table Runners""]",299.0,299.0,4.0
Foolzy Pack of 24 Lipsticks 84 g,"[""Beauty and Personal Care >> Makeup >> Lips >> Lipsticks >> Foolzy Lipsticks""]",2499.0,1299.0,5.0
Maybelline Super Stay 14 Hr Lipstick with Coral Craze Nail Enamel 3.3 g,"[""Beauty and Personal Care >> Makeup >> Lips >> Lipsticks >> Maybelline Lipsticks""]",575.0,575.0,3.0
Canon Toner Cartridge 416 Black,"[""Computers >> Computer Peripherals >> Printers & Inks >> Toners >> Canon Toners""]",4395.0,3220.0,2.2
StyleToss Full Sleeve Solid Women's Sweatshirt,"[""Clothing >> Women's Clothing >> Winter & Seasonal Wear >> Sweatshirts >> StyleToss Sweatshirts""]",699.0,454.0,2.0
Wrangler Printed Men's Round Neck T-Shirt,"[""Clothing >> Men's Clothing >> T-Shirts >> Wrangler T-Shirts""]",995.0,995.0,4.0
White Kalia Graphic Print Men's Round Neck T-Shirt,"[""Clothing >> Men's Clothing >> T-Shirts >> White Kalia T-Shirts""]",699.0,299.0,4.7
Well on Embroidered Men's Polo Neck T-Shirt,"[""Clothing >> Men's Clothing >> T-Shirts >> Well on T-Shirts""]",600.0,380.0,5.0
Wrangler Solid Men's V-neck T-Shirt,"[""Clothing >> Men's Clothing >> T-Shirts >> Wrangler T-Shirts""]",695.0,695.0,3.0
Wrogn Solid Men's V-neck T-Shirt,"[""Clothing >> Men's Clothing >> T-Shirts >> Wrogn T-Shirts""]",899.0,449.0,5.0
Esteem Boy's Drawer,"[""Clothing >> Kids' Clothing >> Boys Wear >> Innerwear & Sleepwear >> Bloomers & Drawers >> Esteem Bloomers & Drawers >> Esteem Boy's Drawer""]",800.0,415.0,5.0
StyloFashionGarments slim Fit Women's Jeans,"[""Clothing >> Women's Clothing >> Western Wear >> Jeans & Shorts >> Jeans >> StyloFashionGarments Jeans >> StyloFashionGarments slim Fit Women's Jeans""]",1295.0,698.0,5.0
Nucode Graphic Print Men's Round Neck T-Shirt,"[""Clothing >> Men's Clothing >> T-Shirts >> Nucode T-Shirts""]",810.0,399.0,5.0
Numero Uno Printed Men's Round Neck T-Shirt,"[""Clothing >> Men's Clothing >> T-Shirts >> Numero Uno T-Shirts""]",899.0,899.0,4.0
Ovl Graphic Print Men's Round Neck T-Shirt,"[""Clothing >> Men's Clothing >> T-Shirts >> Ovl T-Shirts""]",699.0,454.0,5.0
Ninja Turtles Printed Men's Round Neck T-Shirt,"[""Clothing >> Men's Clothing >> T-Shirts >> Ninja Turtles T-Shirts""]",699.0,418.0,3.0
Ninja Turtle Printed Men's Polo T-Shirt,"[""Clothing >> Men's Clothing >> T-Shirts >> Ninja Turtle T-Shirts""]",799.0,478.0,2.0
Numero Uno Printed Men's V-neck T-Shirt,"[""Clothing >> Men's Clothing >> T-Shirts >> Numero Uno T-Shirts""]",849.0,678.0,4.0
Nivia Solid Men's Round Neck T-Shirt,"[""Clothing >> Men's Clothing >> T-Shirts >> Nivia T-Shirts""]",398.0,398.0,3.3
Ocean Race Solid Men's Round Neck T-Shirt,"[""Clothing >> Men's Clothing >> T-Shirts >> Ocean Race T-Shirts""]",448.0,349.0,3.0
Orange and Orchid Striped Men's Polo T-Shirt,"[""Clothing >> Men's Clothing >> T-Shirts >> Orange and Orchid T-Shirts""]",899.0,299.0,4.0
Nucode Striped Men's Polo Neck T-Shirt,"[""Clothing >> Men's Clothing >> T-Shirts >> Nucode T-Shirts""]",1099.0,499.0,5.0
Nod'R Solid Men's Round Neck T-Shirt,"[""Clothing >> Men's Clothing >> T-Shirts >> Nod'R T-Shirts""]",599.0,399.0,5.0
Ninja Turtles Printed Men's Round Neck T-Shirt,"[""Clothing >> Men's Clothing >> T-Shirts >> Ninja Turtles T-Shirts""]",699.0,418.0,3.0
Nucode Graphic Print Men's Round Neck T-Shirt,"[""Clothing >> Men's Clothing >> T-Shirts >> Nucode T-Shirts""]",849.0,299.0,4.0
Omtex Solid Men's Polo Neck T-Shirt,"[""Clothing >> Men's Clothing >> T-Shirts >> Omtex T-Shirts""]",775.0,775.0,2.7
Nucode Solid Men's Polo Neck T-Shirt,"[""Clothing >> Men's Clothing >> T-Shirts >> Nucode T-Shirts""]",599.0,399.0,5.0
Numero Uno Striped Men's Polo T-Shirt,"[""Clothing >> Men's Clothing >> T-Shirts >> Numero Uno T-Shirts""]",1599.0,1599.0,1.0
Nucode Graphic Print Men's Round Neck T-Shirt,"[""Clothing >> Men's Clothing >> T-Shirts >> Nucode T-Shirts""]",799.0,249.0,5.0
Nucode Solid Men's Polo Neck T-Shirt,"[""Clothing >> Men's Clothing >> T-Shirts >> Nucode T-Shirts""]",1099.0,499.0,3.0
Nucode Graphic Print Men's Round Neck T-Shirt,"[""Clothing >> Men's Clothing >> T-Shirts >> Nucode T-Shirts""]",749.0,399.0,5.0
Numero Uno Striped Men's V-neck T-Shirt,"[""Clothing >> Men's Clothing >> T-Shirts >> Numero Uno T-Shirts""]",1399.0,839.0,3.0
Nimya Solid Men's Polo Neck T-Shirt,"[""Clothing >> Men's Clothing >> T-Shirts >> Nimya T-Shirts""]",1199.0,299.0,5.0
Nitlon Solid Men's Round Neck T-Shirt,"[""Clothing >> Men's Clothing >> T-Shirts >> Nitlon T-Shirts""]",775.0,609.0,5.0
Ninja Turtle Printed Men's Round Neck T-Shirt,"[""Clothing >> Men's Clothing >> T-Shirts >> Ninja Turtle T-Shirts""]",599.0,599.0,3.7
Numero Uno Solid Men's V-neck T-Shirt,"[""Clothing >> Men's Clothing >> T-Shirts >> Numero Uno T-Shirts""]",849.0,764.0,5.0
Ocean Race Graphic Print Men's Round Neck T-Shirt,"[""Clothing >> Men's Clothing >> T-Shirts >> Ocean Race T-Shirts""]",598.0,299.0,5.0
Nucode Striped Men's Polo Neck T-Shirt,"[""Clothing >> Men's Clothing >> T-Shirts >> Nucode T-Shirts""]",1049.0,499.0,5.0
Orange and Orchid Striped Men's Polo T-Shirt,"[""Clothing >> Men's Clothing >> T-Shirts >> Orange and Orchid T-Shirts""]",1499.0,499.0,4.0
Ocean 9 Solid Men's Polo T-Shirt,"[""Clothing >> Men's Clothing >> T-Shirts >> Ocean 9 T-Shirts""]",745.0,699.0,3.5
Ocean 9 Solid Men's Fashion Neck T-Shirt,"[""Clothing >> Men's Clothing >> T-Shirts >> Ocean 9 T-Shirts""]",845.0,799.0,1.0
Nucode Graphic Print Men's Round Neck T-Shirt,"[""Clothing >> Men's Clothing >> T-Shirts >> Nucode T-Shirts""]",799.0,399.0,4.3
Ovl Graphic Print Men's Round Neck T-Shirt,"[""Clothing >> Men's Clothing >> T-Shirts >> Ovl T-Shirts""]",599.0,419.0,5.0
Ovl Graphic Print Men's Round Neck T-Shirt,"[""Clothing >> Men's Clothing >> T-Shirts >> Ovl T-Shirts""]",699.0,454.0,3.7
Nucode Graphic Print Men's V-neck T-Shirt,"[""Clothing >> Men's Clothing >> T-Shirts >> Nucode T-Shirts""]",699.0,299.0,5.0
Ninja Turtle Printed Men's Round Neck T-Shirt,"[""Clothing >> Men's Clothing >> T-Shirts >> Ninja Turtle T-Shirts""]",599.0,599.0,3.0
Ninja Turtle Printed Men's Round Neck T-Shirt,"[""Clothing >> Men's Clothing >> T-Shirts >> Ninja Turtle T-Shirts""]",749.0,448.0,5.0
Orange and Orchid Printed Men's Round Neck T-Shirt,"[""Clothing >> Men's Clothing >> T-Shirts >> Orange and Orchid T-Shirts""]",999.0,499.0,3.0
Ninja Turtle Printed Men's Round Neck T-Shirt,"[""Clothing >> Men's Clothing >> T-Shirts >> Ninja Turtle T-Shirts""]",599.0,599.0,3.7
Numero Uno Striped Men's Polo T-Shirt,"[""Clothing >> Men's Clothing >> T-Shirts >> Numero Uno T-Shirts""]",1599.0,1599.0,5.0
Okane Self Design Men's Polo Neck T-Shirt,"[""Clothing >> Men's Clothing >> T-Shirts >> Okane T-Shirts""]",500.0,500.0,1.0
Ovl Graphic Print Men's Round Neck T-Shirt,"[""Clothing >> Men's Clothing >> T-Shirts >> Ovl T-Shirts""]",699.0,454.0,5.0
Nucode Graphic Print Men's Round Neck T-Shirt,"[""Clothing >> Men's Clothing >> T-Shirts >> Nucode T-Shirts""]",799.0,399.0,5.0
Nitlon Solid Men's Round Neck T-Shirt,"[""Clothing >> Men's Clothing >> T-Shirts >> Nitlon T-Shirts""]",155.0,155.0,3.1
Numero Uno Striped Men's Polo T-Shirt,"[""Clothing >> Men's Clothing >> T-Shirts >> Numero Uno T-Shirts""]",1199.0,958.0,1.0
Nucode Striped Men's Polo Neck T-Shirt,"[""Clothing >> Men's Clothing >> T-Shirts >> Nucode T-Shirts""]",1099.0,499.0,5.0
Nuteez Printed Men's Round Neck T-Shirt,"[""Clothing >> Men's Clothing >> T-Shirts >> Nuteez T-Shirts""]",450.0,450.0,3.0
"Orange and Orchid Solid, Printed Men's Round Neck T-Shirt","[""Clothing >> Men's Clothing >> T-Shirts >> Orange and Orchid T-Shirts""]",749.0,399.0,4.0
Nucode Graphic Print Men's Round Neck T-Shirt,"[""Clothing >> Men's Clothing >> T-Shirts >> Nucode T-Shirts""]",760.0,329.0,5.0
Nucode Geometric Print Men's Round Neck T-Shirt,"[""Clothing >> Men's Clothing >> T-Shirts >> Nucode T-Shirts""]",799.0,480.0,5.0
Numero Uno Printed Men's Polo Neck T-Shirt,"[""Clothing >> Men's Clothing >> T-Shirts >> Numero Uno T-Shirts""]",899.0,718.0,2.0
Nivia Solid Men's Round Neck T-Shirt,"[""Clothing >> Men's Clothing >> T-Shirts >> Nivia T-Shirts""]",398.0,398.0,3.0
Nucode Graphic Print Men's Round Neck T-Shirt,"[""Clothing >> Men's Clothing >> T-Shirts >> Nucode T-Shirts""]",699.0,399.0,5.0
Nucode Graphic Print Men's Round Neck T-Shirt,"[""Clothing >> Men's Clothing >> T-Shirts >> Nucode T-Shirts""]",749.0,399.0,4.5
Orange and Orchid Printed Men's Round Neck T-Shirt,"[""Clothing >> Men's Clothing >> T-Shirts >> Orange and Orchid T-Shirts""]",749.0,499.0,2.0
O And O Printed Men's Round Neck T-Shirt,"[""Clothing >> Men's Clothing >> T-Shirts >> O And O T-Shirts""]",899.0,299.0,5.0
Numero Uno Striped Men's Polo T-Shirt,"[""Clothing >> Men's Clothing >> T-Shirts >> Numero Uno T-Shirts""]",1299.0,1299.0,5.0
Numero Uno Solid Men's V-neck T-Shirt,"[""Clothing >> Men's Clothing >> T-Shirts >> Numero Uno T-Shirts""]",1699.0,1699.0,4.7
Omtex Solid Men's Polo Neck T-Shirt,"[""Clothing >> Men's Clothing >> T-Shirts >> Omtex T-Shirts""]",600.0,600.0,2.7
Numero Uno Striped Men's Polo T-Shirt,"[""Clothing >> Men's Clothing >> T-Shirts >> Numero Uno T-Shirts""]",1599.0,1599.0,1.0
Ovl Graphic Print Men's Round Neck T-Shirt,"[""Clothing >> Men's Clothing >> T-Shirts >> Ovl T-Shirts""]",599.0,419.0,3.0
Ovl Graphic Print Men's Round Neck T-Shirt,"[""Clothing >> Men's Clothing >> T-Shirts >> Ovl T-Shirts""]",599.0,419.0,5.0
Nucode Striped Men's Polo Neck T-Shirt,"[""Clothing >> Men's Clothing >> T-Shirts >> Nucode T-Shirts""]",1079.0,499.0,5.0
Numero Uno Striped Men's Polo T-Shirt,"[""Clothing >> Men's Clothing >> T-Shirts >> Numero Uno T-Shirts""]",1599.0,1599.0,5.0
Orange and Orchid Solid Men's Round Neck T-Shirt,"[""Clothing >> Men's Clothing >> T-Shirts >> Orange and Orchid T-Shirts""]",599.0,349.0,1.0
Orange and Orchid Printed Men's Round Neck T-Shirt,"[""Clothing >> Men's Clothing >> T-Shirts >> Orange and Orchid T-Shirts""]",749.0,499.0,2.0
Nucode Graphic Print Men's Round Neck T-Shirt,"[""Clothing >> Men's Clothing >> T-Shirts >> Nucode T-Shirts""]",699.0,299.0,5.0
Nucode Graphic Print Men's Round Neck T-Shirt,"[""Clothing >> Men's Clothing >> T-Shirts >> Nucode T-Shirts""]",760.0,299.0,5.0
Ocean Race Graphic Print Men's Round Neck T-Shirt,"[""Clothing >> Men's Clothing >> T-Shirts >> Ocean Race T-Shirts""]",598.0,299.0,1.0
Ocean Race Solid Men's Round Neck T-Shirt,"[""Clothing >> Men's Clothing >> T-Shirts >> Ocean Race T-Shirts""]",548.0,399.0,3.0
Kakori Handcrafted Seated Musician having Red Color and Nickel Polish Finish Showpiece  -  17 cm,"[""Home Decor & Festive Needs >> Showpieces >> Kakori Showpieces""]",900.0,655.0,3.0
Udaipur Art Gallery Wooden Decorative Platter,"[""Home Decor & Festive Needs >> Table Decor & Handicrafts >> Decorative Platters >> Udaipur Art Gallery Decorative Platters""]",750.0,399.0,5.0
Pavvoin Lingerie Set,"[""Clothing >> Women's Clothing >> Lingerie, Sleep & Swimwear >> Lingerie Sets >> Pavvoin Lingerie Sets >> Pavvoin Lingerie Set""]",999.0,445.0,5.0
Fogg Fashion Store 3003-PK Modish Analog Watch  - For Women,"[""Watches >> Wrist Watches >> Fogg Fashion Store Wrist Watches""]",999.0,329.0,5.0
Luba HH41 Stylo Analog Watch  - For Women,"[""Watches >> Wrist Watches >> Luba Wrist Watches""]",350.0,199.0,3.5
"Pavechas Solid, Striped Mangalagiri Cotton Sari","[""Clothing >> Women's Clothing >> Ethnic Wear >> Sarees >> Pavechas Sarees""]",1499.0,599.0,3.0
New Day Graphic Print Boy's Round Neck T-Shirt,"[""Clothing >> Kids' Clothing >> Boys Wear >> Polos & T-Shirts >> New Day Polos & T-Shirts""]",640.0,640.0,5.0
Ben Carter Slim Fit Men's Jeans,"[""Clothing >> Men's Clothing >> Jeans >> Ben Carter Jeans""]",1399.0,599.0,2.9
Stanley 14-125 Glass Cutter,"[""Tools & Hardware >> Tools >> Hand Tools >> Cutters & Snips >> Cutters""]",185.0,149.0,3.1
My Foot Women Heels,"[""Footwear >> Women's Footwear >> Heels""]",1599.0,956.0,5.0
R18Jewels-Fashion&U Sparkle Delight Metal Bangle Set,"[""Jewellery >> Bangles, Bracelets & Armlets >> Bangles""]",650.0,297.0,5.0
Chevron 6 Card Holder,"[""Bags, Wallets & Belts >> Wallets & Clutches >> Travel Document Holders & Card Holders >> Card Holders >> Chevron Card Holders""]",599.0,179.0,2.6
Tales & Stories Slim Fit Boy's Jeans,"[""Clothing >> Kids' Clothing >> Boys Wear >> Jeans >> Tales & Stories Jeans""]",1299.0,779.0,4.0
Elligator 10 Card Holder,"[""Bags, Wallets & Belts >> Wallets & Clutches >> Travel Document Holders & Card Holders >> Card Holders >> Elligator Card Holders""]",2995.0,299.0,4.0
Best 6 Card Holder,"[""Bags, Wallets & Belts >> Wallets & Clutches >> Travel Document Holders & Card Holders >> Card Holders >> Best Card Holders""]",699.0,127.0,1.0
Rajasthan Crafts Abstract Single Quilts & Comforters Multicolor,"[""Home Furnishing >> Bed Linen >> Blankets, Quilts & Dohars""]",950.0,840.0,3.0
Rajasthan Crafts Abstract Single Quilts & Comforters Pink,"[""Home Furnishing >> Bed Linen >> Blankets, Quilts & Dohars""]",950.0,840.0,4.0
Earth Ro System Abstract Single Quilts & Comforters Multicolor,"[""Home Furnishing >> Bed Linen >> Blankets, Quilts & Dohars""]",2450.0,1000.0,5.0
Geneva GEN-05 Crystal Studded Analog Watch  - For Women,"[""Watches >> Wrist Watches >> Geneva Wrist Watches""]",2399.0,1050.0,3.0
Pavechas Printed Kanjivaram Art Silk Sari,"[""Clothing >> Women's Clothing >> Ethnic Wear >> Sarees >> Pavechas Sarees""]",4799.0,2399.0,4.0
Perucci PC-3333Purple Analog Watch  - For Women,"[""Watches >> Wrist Watches >> Perucci Wrist Watches""]",2500.0,1295.0,3.0
Perucci PC-3333Yellow Analog Watch  - For Women,"[""Watches >> Wrist Watches >> Perucci Wrist Watches""]",2500.0,1395.0,1.3
Perucci PC-310 Analog Watch  - For Men,"[""Watches >> Wrist Watches >> Perucci Wrist Watches""]",2500.0,1395.0,2.0
Chappin & Nellson CNL-50-White-RG Analog Watch  - For Women,"[""Watches >> Wrist Watches >> Chappin & Nellson Wrist Watches""]",1999.0,799.0,3.7
Chappin & Nellson CNL-50-White Analog Watch  - For Women,"[""Watches >> Wrist Watches >> Chappin & Nellson Wrist Watches""]",1999.0,799.0,5.0
Port Fusion Football Shoes,"[""Footwear >> Men's Footwear >> Sports Shoes >> Port Sports Shoes""]",1299.0,599.0,4.0
FS Mini Klub Solid Baby Boy's Pathani Kurta,"[""Clothing >> Kids' Clothing >> Infants Wear >> Baby Boys >> Ethnic Wear >> Kurtas >> FS Mini Klub Kurtas""]",899.0,539.0,5.0
Xemex ST1025SL07 New Generation Analog Watch  - For Women,"[""Watches >> Wrist Watches >> Xemex Wrist Watches""]",650.0,275.0,5.0
"Ireeya Abstract Single Coral Blanket White, Purple","[""Baby Care >> Baby Bedding >> Baby Blankets >> Ireeya Baby Blankets""]",850.0,529.0,5.0
My NewBorn Solid Single Wrapper Assorted Muti Colors,"[""Baby Care >> Baby Bedding >> Baby Blankets >> My NewBorn Baby Blankets""]",1999.0,550.0,3.2
Total Care TC-L830 Screen Guard for Nokia Lumia 830,"[""Mobiles & Accessories >> Mobile Accessories >> Screen Protectors >> Total Care Screen Protectors""]",399.0,175.0,4.8
Karpine Glass Screen Guard for Nokia Lumia 830,"[""Mobiles & Accessories >> Mobile Accessories >> Screen Protectors >> Karpine Screen Protectors""]",999.0,399.0,1.0
Karpine Clear Screen Guard for Nokia lumia 830,"[""Mobiles & Accessories >> Mobile Accessories >> Screen Protectors >> Karpine Screen Protectors""]",549.0,149.0,3.7
Casotec Super Clear Screen Protector Screen Guard for Nokia Lumia 830,"[""Mobiles & Accessories >> Mobile Accessories >> Screen Protectors >> Casotec Screen Protectors""]",199.0,79.0,5.0
Total Care TCMTZC1FB Matte Front & Back Protector for Sony Xperia Z1 Compact,"[""Mobiles & Accessories >> Mobile Accessories >> Screen Protectors >> Total Care Screen Protectors""]",399.0,199.0,1.0
Nillkin Z3-84345 Mirror Screen Guard for Blackberry Z3,"[""Mobiles & Accessories >> Mobile Accessories >> Screen Protectors >> Nillkin Screen Protectors""]",999.0,598.0,5.0
Chicopee Women Flats,"[""Footwear >> Women's Footwear >> Flats""]",1499.0,749.0,5.0
Love Baby Cartoon Set of Towels,"[""Baby Care >> Baby Bath & Skin >> Baby Bath Towels >> Love Baby Baby Bath Towels""]",638.0,425.0,4.3
Momento Regular Fit Men's Jeans,"[""Clothing >> Men's Clothing >> Jeans >> Momento Jeans""]",1490.0,990.0,3.0
LUBA bh23 Stylo Analog Watch  - For Men,"[""Watches >> Wrist Watches >> LUBA Wrist Watches""]",899.0,289.0,5.0
Mark Home Cotton Bath Towel,"[""Home Furnishing >> Bath Linen >> Towels""]",799.0,599.0,5.0
LUBA ty47 Stylo Analog Watch  - For Men,"[""Watches >> Wrist Watches >> LUBA Wrist Watches""]",345.0,199.0,4.0
Swisstyle SS-GR1409-BLK-CH Flunky Analog Watch  - For Men,"[""Watches >> Wrist Watches >> Swisstyle Wrist Watches""]",999.0,449.0,5.0
Goddess Women Women's Animal Print Casual Shirt,"[""Clothing >> Women's Clothing >> Western Wear >> Shirts, Tops & Tunics >> Shirts >> Goddess Women Shirts""]",1299.0,909.0,1.0
Trend18 Women's Animal Print Casual Shirt,"[""Clothing >> Women's Clothing >> Western Wear >> Shirts, Tops & Tunics >> Shirts >> Trend18 Shirts""]",699.0,449.0,3.5
Younky Women's Animal Print Casual Shirt,"[""Clothing >> Women's Clothing >> Western Wear >> Shirts, Tops & Tunics >> Shirts >> Younky Shirts""]",1999.0,349.0,5.0
H2O Plus Eye Oasis Moisture Replenishment Treatment,"[""Beauty and Personal Care >> Eye Care >> H2O Plus Eye Care""]",1400.0,840.0,4.0
President School Waterproof Backpack,"[""Toys & School Supplies >> School Supplies >> School Bags >> Backpack >> President Backpack""]",1199.0,785.0,2.8
Indus Beats Striped Men's Boxer,"[""Clothing >> Men's Clothing >> Inner Wear & Sleep Wear >> Boxers >> Indus Beats Boxers""]",799.0,299.0,4.8
President School Waterproof Backpack,"[""Toys & School Supplies >> School Supplies >> School Bags >> Backpack >> President Backpack""]",1200.0,799.0,4.2
April6 Woven Checkered Men's Boxer,"[""Clothing >> Men's Clothing >> Inner Wear & Sleep Wear >> Boxers >> April6 Boxers""]",549.0,389.0,4.8
President School Waterproof Backpack,"[""Toys & School Supplies >> School Supplies >> School Bags >> Backpack >> President Backpack""]",849.0,699.0,2.8
April6 Daniel Printed Men's Boxer,"[""Clothing >> Men's Clothing >> Inner Wear & Sleep Wear >> Boxers >> April6 Boxers""]",549.0,289.0,4.5
Chaddy Buddy Gaand Faadu Printed Men's Boxer,"[""Clothing >> Men's Clothing >> Inner Wear & Sleep Wear >> Boxers >> Chaddy Buddy Boxers""]",999.0,549.0,5.0
Wineberry Show Off Checkered Men's Boxer,"[""Clothing >> Men's Clothing >> Inner Wear & Sleep Wear >> Boxers >> Wineberry Boxers""]",299.0,275.0,1.0
Debenhams-Jasper Conran Women's Camisole,"[""Clothing >> Women's Clothing >> Lingerie, Sleep & Swimwear >> Camisoles & Slips >> Debenhams-Jasper Conran Camisoles & Slips""]",1795.0,1795.0,4.7
Rana Watches Bw-Prsmd Barbie Analog Watch  - For Girls,"[""Watches >> Wrist Watches >> Rana Watches Wrist Watches""]",275.0,199.0,3.8
"Primes Boys, Girls Sandals","[""Footwear >> Kids' & Infant Footwear >> For Boys >> Clogs""]",599.0,439.0,4.0
"Pick Pocket Women Casual Black Cotton, Canvas Sling Bag","[""Bags, Wallets & Belts >> Bags >> Sling Bags >> Pick Pocket Sling Bags""]",399.0,359.0,3.5
Liza Women Wedges,"[""Footwear >> Women's Footwear >> Wedges""]",1790.0,1074.0,2.0
Vogue Tree Women Casual Blue Canvas Sling Bag,"[""Bags, Wallets & Belts >> Bags >> Sling Bags >> Vogue Tree Sling Bags""]",599.0,433.0,3.0
Catwalk Women Wedges,"[""Footwear >> Women's Footwear >> Wedges""]",1695.0,999.0,4.5
"Pearl Paradise Pearl Paradise ""Kundan necklace"". Brass Jewel Set","[""Jewellery >> Jewellery Sets""]",3898.0,2860.0,5.0
Pilot Roller Ball Pen,"[""Pens & Stationery >> Pens >> Roller Ball Pens >> Pilot Roller Ball Pens""]",960.0,960.0,5.0
Pilot Roller Ball Pen,"[""Pens & Stationery >> Pens >> Roller Ball Pens >> Pilot Roller Ball Pens""]",1140.0,1095.0,3.0
"Pearlz Ocean Pleasing Alloy Pearl, Crystal Yellow Gold Bracelet","[""Jewellery >> Bangles, Bracelets & Armlets >> Bracelets""]",1600.0,399.0,5.0
Swiss Charger Cable de synchro micro USB USB Cable,"[""Mobiles & Accessories >> Mobile Accessories >> Cables >> Swiss Charger Cables""]",599.0,599.0,5.0
Remax Micro USB Data Sync & Charging Cable USB Cable,"[""Mobiles & Accessories >> Mobile Accessories >> Cables >> Remax Cables""]",799.0,250.0,5.0
Avantree Micro USB Retractable USB Cable,"[""Mobiles & Accessories >> Mobile Accessories >> Cables >> Avantree Cables""]",599.0,499.0,3.0
LG EAD63689301 USB Cable,"[""Mobiles & Accessories >> Mobile Accessories >> Cables >> LG Cables""]",249.0,249.0,4.6
Uniball SAR Ball Pen,"[""Pens & Stationery >> Pens >> Ball Pens >> Uniball Ball Pens""]",150.0,145.0,4.0
"Pearl Paradise ""Ink drop"" Swarovski Crystal Silver Dangle Earring","[""Jewellery >> Earrings""]",2480.0,1880.0,5.0
Regent Analog 28 cm Dia Wall Clock,"[""Home Decor & Festive Needs >> Wall Decor & Clocks >> Clocks >> Wall Clocks >> Regent Wall Clocks""]",1299.0,799.0,3.7
"Pearl Paradise Briolette With ""Ruby Red "". Swarovski Crystal Stone Dangle Earring","[""Jewellery >> Earrings""]",1480.0,1350.0,4.2
eCraftIndia Analog 2.5 cm Dia Wall Clock,"[""Home Decor & Festive Needs >> Wall Decor & Clocks >> Clocks >> Wall Clocks >> eCraftIndia Wall Clocks""]",2199.0,1153.0,3.0
Pearl Paradise Elements Swarovski Crystal Stone Dangle Earring,"[""Jewellery >> Earrings""]",1380.0,1242.0,4.8
People Graphic Print Women's Round Neck T-Shirt,"[""Clothing >> Women's Clothing >> Western Wear >> Shirts, Tops & Tunics >> Polos & T-Shirts >> People Polos & T-Shirts""]",399.0,200.0,4.0
People Printed Women's Round Neck T-Shirt,"[""Clothing >> Women's Clothing >> Western Wear >> Shirts, Tops & Tunics >> Polos & T-Shirts >> People Polos & T-Shirts""]",399.0,200.0,1.0
Pearl Paradise Briolette With Moonlight Elements. Swarovski Crystal Stone Dangle Earring,"[""Jewellery >> Earrings""]",1380.0,966.0,5.0
Pearl Paradise Complete Women - (A) Swarovski Crystal Silver Dangle Earring,"[""Jewellery >> Earrings""]",3280.0,1895.0,1.0
"Pearl Paradise Long ""Black Diamond"" Swarovski Crystal Stone Dangle Earring","[""Jewellery >> Earrings""]",1980.0,1386.0,5.0
Regent Analog 28 cm Dia Wall Clock,"[""Home Decor & Festive Needs >> Wall Decor & Clocks >> Clocks >> Wall Clocks >> Regent Wall Clocks""]",1299.0,799.0,4.0
Regent Analog 31 cm Dia Wall Clock,"[""Home Decor & Festive Needs >> Wall Decor & Clocks >> Clocks >> Wall Clocks >> Regent Wall Clocks""]",1599.0,699.0,1.0
Regent Analog 31 cm Dia Wall Clock,"[""Home Decor & Festive Needs >> Wall Decor & Clocks >> Clocks >> Wall Clocks >> Regent Wall Clocks""]",1599.0,749.0,2.8
Yepme Graphic Print Women's Round Neck T-Shirt,"[""Clothing >> Women's Clothing >> Western Wear >> Shirts, Tops & Tunics >> Polos & T-Shirts >> Yepme Polos & T-Shirts""]",699.0,349.0,5.0
"NEVI Flower Swarovski Crystal, Crystal Alloy, Crystal Pendant","[""Jewellery >> Pendants & Lockets""]",4850.0,2250.0,5.0
"NEVI Swarovski Crystal Alloy, Crystal Pendant","[""Jewellery >> Pendants & Lockets""]",4850.0,2250.0,4.2
"NEVI Swarovski Crystal, Crystal Alloy, Crystal Pendant","[""Jewellery >> Pendants & Lockets""]",2500.0,1200.0,3.3
Suvarnadeep Rose Rhodium Zircon Sterling Silver Pendant,"[""Jewellery >> Pendants & Lockets""]",1550.0,1550.0,3.0
"NEVI Butterfly Swarovski Crystal, Crystal Alloy, Crystal Pendant","[""Jewellery >> Pendants & Lockets""]",4200.0,2199.0,5.0
Xenio GL86 Tempered Glass for Huawei Honor 6,"[""Mobiles & Accessories >> Mobile Accessories >> Screen Protectors >> Xenio Screen Protectors""]",999.0,180.0,1.0
Neutron HR-06 Tempered Glass for Huawei Honor 6,"[""Mobiles & Accessories >> Mobile Accessories >> Screen Protectors >> Neutron Screen Protectors""]",799.0,299.0,1.0
Molife M-SLTG-HONOR6PLUS Tempered Glass for Huawei Honor 6 Plus,"[""Mobiles & Accessories >> Mobile Accessories >> Screen Protectors >> Molife Screen Protectors""]",1299.0,199.0,3.7
