nama_produk,jenis_produk,harga_retail,harga_diskon,rating
Ladela Bellies,"[""Footwear >> Women's Footwear >> Ballerinas >> Ladela Bellies""]",1724.0,950.0,5.0
Bulaky vanity case Jewellery Vanity Case,"[""Beauty and Personal Care >> Makeup >> Vanity Boxes >> Bulaky Vanity Boxes""]",499.0,390.0,3.0
Roadster Men's Zipper Solid Cardigan,"[""Clothing >> Men's Clothing >> Winter & Seasonal Wear >> Cardigans >> Roadster Cardigans >> Roadster Men's Zipper Solid Cardigan""]",1399.0,699.0,3.6
"Camerii WM64 Elegance Analog Watch  - For Men, Boys","[""Watches >> Wrist Watches >> Camerii Wrist Watches""]",1099.0,449.0,5.0
"Colat COLAT_MW20 Sheen Analog Watch  - For Men, Women, Boys, Girls","[""Watches >> Wrist Watches >> Colat Wrist Watches""]",3999.0,849.0,5.0
"Rorlig RR-028 Expedition Analog Watch  - For Men, Boys","[""Watches >> Wrist Watches >> Rorlig Wrist Watches""]",1099.0,399.0,5.0
Lyc White Casual Boots,"[""Footwear >> Women's Footwear >> Casual Shoes >> Boots""]",1199.0,899.0,5.0
Fluid DMF-002-GR01 Digital Watch  - For Boys,"[""Watches >> Wrist Watches >> Fluid Wrist Watches""]",1699.0,849.0,3.5
Bruno Manetti Cannelita Boots,"[""Footwear >> Women's Footwear >> Casual Shoes >> Boots""]",3399.0,1359.0,4.4
"Kool Kidz DMK-012-QU02 Analog Watch  - For Girls, Boys","[""Watches >> Wrist Watches >> Kool Kidz Wrist Watches""]",375.0,263.0,5.0
"Kool Kidz DMK-003-YL 03 Analog Watch  - For Girls, Boys","[""Watches >> Wrist Watches >> Kool Kidz Wrist Watches""]",475.0,333.0,4.0
Kielz Ladies Boots,"[""Footwear >> Women's Footwear >> Casual Shoes >> Boots""]",2499.0,1149.0,3.5
"Colat COLAT_M08 Roman Numerals Analog Watch  - For Men, Boys","[""Watches >> Wrist Watches >> Colat Wrist Watches""]",4999.0,1049.0,5.0
Kielz Ladies Boots,"[""Footwear >> Women's Footwear >> Casual Shoes >> Boots""]",2299.0,899.0,3.5
"Srushti Art Jewelry Megnet_Led_Sport_BlackRed1 Digital Watch  - For Men, Women, Boys, Girls","[""Watches >> Wrist Watches >> Srushti Art Jewelry Wrist Watches""]",799.0,200.0,5.0
"Q&Q VQ13-008 Analog Watch  - For Girls, Boys","[""Watches >> Wrist Watches >> Q&Q Wrist Watches""]",585.0,526.0,3.6
Jack klein BlackLed Digital Watch  - For Boys,"[""Watches >> Wrist Watches >> Jack klein Wrist Watches""]",999.0,150.0,1.0
"North Moon IW-005-FK Silicone Ion Digital Watch  - For Boys, Girls, Women","[""Watches >> Wrist Watches >> North Moon Wrist Watches""]",235.0,150.0,2.3
Roadster Skinny Fit Fit Men's Jeans,"[""Clothing >> Men's Clothing >> Jeans >> Roadster Jeans""]",2499.0,1249.0,3.0
"Q&Q LLA2-213 Digital Watch  - For Boys, Girls","[""Watches >> Wrist Watches >> Q&Q Wrist Watches""]",645.0,645.0,5.0
Belle Gambe Winter Boots,"[""Footwear >> Women's Footwear >> Casual Shoes >> Boots""]",3499.0,1695.0,4.8
"Hala Red In Black trendy digital Digital Watch  - For Boys, Girls, Men","[""Watches >> Wrist Watches >> Hala Wrist Watches""]",399.0,159.0,5.0
Carlton London Boots,"[""Footwear >> Women's Footwear >> Casual Shoes >> Boots""]",2295.0,2295.0,5.0
Ridas Apl_led_black Apple Shape Digital Watch  - For Boys,"[""Watches >> Wrist Watches >> Ridas Wrist Watches""]",349.0,249.0,2.7
La Briza Andria Boots,"[""Footwear >> Women's Footwear >> Casual Shoes >> Boots""]",2099.0,2099.0,3.6
"Skmei 1070BLK Sports Analog-Digital Watch  - For Men, Boys","[""Watches >> Wrist Watches >> Skmei Wrist Watches""]",2345.0,1179.0,4.4
"Felix 3541 W-S METAL Analog Watch  - For Boys, Girls","[""Watches >> Wrist Watches >> Felix Wrist Watches""]",1350.0,555.0,5.0
Steppings Trendy Boots,"[""Footwear >> Women's Footwear >> Casual Shoes >> Boots""]",1799.0,719.0,4.0
"Jack Klein Goldjack Analog Watch  - For Boys, Men","[""Watches >> Wrist Watches >> Jack Klein Wrist Watches""]",1999.0,262.0,5.0
Dearfoams Boots,"[""Footwear >> Women's Footwear >> Casual Shoes >> Boots""]",1820.0,1820.0,5.0
"Alfajr WQ18 Qibla Compass Digital Watch  - For Men, Boys, Girls","[""Watches >> Wrist Watches >> Alfajr Wrist Watches""]",8995.0,7495.0,5.0
"3wish CUR-BLUE Silver Blue 8023 Analog Watch  - For Boys, Men","[""Watches >> Wrist Watches >> 3wish Wrist Watches""]",2999.0,995.0,5.0
Belle Gambe Boots,"[""Footwear >> Women's Footwear >> Casual Shoes >> Boots""]",3499.0,1795.0,3.0
"Elantra S 10 Analog Watch  - For Boys, Men","[""Watches >> Wrist Watches >> Elantra Wrist Watches""]",2150.0,950.0,4.5
"Marvel DW100243 Digital Watch  - For Boys, Girls","[""Watches >> Wrist Watches >> Marvel Wrist Watches""]",299.0,299.0,4.0
Steppings Trendy Boots,"[""Footwear >> Women's Footwear >> Casual Shoes >> Boots""]",2199.0,1099.0,4.0
"Zoop C4040PP03 Digital Watch  - For Boys, Girls","[""Watches >> Wrist Watches >> Zoop Wrist Watches""]",750.0,750.0,4.5
Carl 3346-1-Cheetablue Boots,"[""Footwear >> Women's Footwear >> Casual Shoes >> Boots""]",2299.0,1149.0,5.0
"Zoop C3030PP05 Analog Watch  - For Boys, Girls","[""Watches >> Wrist Watches >> Zoop Wrist Watches""]",650.0,650.0,4.8
Pure Source Psi-As-Hanggnrlx Relaxing Liquid Air Freshener,"[""Home Decor & Festive Needs >> Candles & Fragrances >> Home Fragrances >> Aroma Oil & Diffuser Sets >> Pure Source Aroma Oil & Diffuser Sets""]",1250.0,375.0,5.0
Peppermint Blues Casual Sleeveless Printed Women's Top,"[""Clothing >> Women's Clothing >> Western Wear >> Shirts, Tops & Tunics >> Tops >> Peppermint Blues Tops""]",399.0,359.0,2.4
Xpert Schoolboys Blk Lace Up Shoes,"[""Footwear >> Kids' & Infant Footwear >> For Boys >> School Shoes""]",399.0,299.0,3.2
The Cranberry Club Girl's Gathered Dress,"[""Clothing >> Kids' Clothing >> Girls Wear >> Dresses & Skirts >> Dresses >> The Cranberry Club Dresses""]",1299.0,999.0,5.0
Hichkii Casual Cape Sleeve Embroidered Women's Top,"[""Clothing >> Women's Clothing >> Western Wear >> Shirts, Tops & Tunics >> Tops >> Hichkii Tops""]",799.0,499.0,4.5
Clara Certified Katela 3 cts or 3.25 ratti 4 Prongs Sterling Silver Amethyst Ring,"[""Jewellery >> Rings""]",3530.0,1570.0,4.0
PrettyPataka Party Full Sleeve Woven Women's Top,"[""Clothing >> Women's Clothing >> Western Wear >> Shirts, Tops & Tunics >> Tops >> PrettyPataka Tops""]",2500.0,899.0,3.5
"Urban Fashion Bank Casual, Party, Festive, Lounge Wear Sleeveless Embellished Women's Top","[""Clothing >> Women's Clothing >> Western Wear >> Shirts, Tops & Tunics >> Tops >> Urban Fashion Bank Tops""]",600.0,365.0,3.0
Hangover Solid Round Neck Women's Sweater,"[""Clothing >> Women's Clothing >> Winter & Seasonal Wear >> Sweaters & Pullovers >> Hangover Sweaters & Pullovers""]",1599.0,499.0,1.0
TeeMoods Casual Full Sleeve Striped Women's Top,"[""Clothing >> Women's Clothing >> Western Wear >> Shirts, Tops & Tunics >> Tops >> TeeMoods Tops""]",999.0,899.0,4.0
Ditu&Kritu Warrior Aviator Sunglasses,"[""Sunglasses""]",999.0,399.0,4.7
Claude Lorrain Black Casuals Shoes,"[""Footwear >> Women's Footwear >> Casual Shoes""]",2750.0,1299.0,5.0
Gritstones Solid Women's Track Pants,"[""Clothing >> Women's Clothing >> Sports & Gym Wear >> Track Pants >> Gritstones Track Pants""]",599.0,499.0,3.0
Gritstones Solid Women's Track Pants,"[""Clothing >> Women's Clothing >> Sports & Gym Wear >> Track Pants >> Gritstones Track Pants""]",599.0,499.0,3.0
Gritstones Solid Women's Track Pants,"[""Clothing >> Women's Clothing >> Sports & Gym Wear >> Track Pants >> Gritstones Track Pants""]",599.0,499.0,2.0
Gritstones Solid Women's Track Pants,"[""Clothing >> Women's Clothing >> Sports & Gym Wear >> Track Pants >> Gritstones Track Pants""]",599.0,499.0,3.0
Ozel Studio Casual Full Sleeve Printed Women's Top,"[""Clothing >> Women's Clothing >> Western Wear >> Shirts, Tops & Tunics >> Tops >> Ozel Studio Tops""]",985.0,591.0,3.0
TeeMoods Casual Full Sleeve Striped Women's Top,"[""Clothing >> Women's Clothing >> Western Wear >> Shirts, Tops & Tunics >> Tops >> TeeMoods Tops""]",1399.0,699.0,1.0
Nishtaa Yellow Gold 22 K Ring,"[""Jewellery >> Rings""]",7810.0,7420.0,5.0
BownBee Girl's Gathered Dress,"[""Clothing >> Kids' Clothing >> Girls Wear >> Dresses & Skirts >> Dresses >> BownBee Dresses""]",999.0,799.0,5.0
Fundoo T Full Sleeve Solid Men's Sweatshirt,"[""Clothing >> Men's Clothing >> Winter & Seasonal Wear >> Sweatshirts >> Fundoo T Sweatshirts""]",1998.0,749.0,5.0
Herberto Girl's A-line Dress,"[""Clothing >> Kids' Clothing >> Girls Wear >> Dresses & Skirts >> Herberto Dresses & Skirts""]",1599.0,649.0,4.0
Cation Casual 3/4 Sleeve Solid Women's Top,"[""Clothing >> Women's Clothing >> Western Wear >> Shirts, Tops & Tunics >> Tops >> Cation Tops""]",1998.0,950.0,2.0
Bells And Whistles Striped Round Neck Boy's Sweater,"[""Clothing >> Kids' Clothing >> Boys Wear >> Winter & Seasonal Wear >> Sweaters >> Bells And Whistles Sweaters""]",1099.0,659.0,5.0
Betty Girl's Maxi Dress,"[""Clothing >> Kids' Clothing >> Girls Wear >> Dresses & Skirts >> Dresses >> Betty Dresses""]",1995.0,1995.0,5.0
Cation Casual 3/4 Sleeve Solid Women's Top,"[""Clothing >> Women's Clothing >> Western Wear >> Shirts, Tops & Tunics >> Tops >> Cation Tops""]",1400.0,499.0,3.0
Yepme Women Flats,"[""Footwear >> Women's Footwear >> Flats""]",399.0,199.0,3.0
Stilestreet Casual Short Sleeve Solid Women's Top,"[""Clothing >> Women's Clothing >> Western Wear >> Shirts, Tops & Tunics >> Tops >> Stilestreet Tops""]",699.0,449.0,4.0
Anaya Women Heels,"[""Footwear >> Women's Footwear >> Heels""]",1699.0,699.0,4.8
Beebay Girl's A-line Dress,"[""Clothing >> Kids' Clothing >> Girls Wear >> Dresses & Skirts >> Dresses >> Beebay Dresses""]",895.0,399.0,4.0
Alibi Casual Short Sleeve Solid Women's Top,"[""Clothing >> Women's Clothing >> Western Wear >> Shirts, Tops & Tunics >> Tops >> Alibi Tops""]",699.0,417.0,2.0
The Vanca Casual 3/4 Sleeve Solid Women's Top,"[""Clothing >> Women's Clothing >> Western Wear >> Shirts, Tops & Tunics >> Tops >> The Vanca Tops""]",1299.0,571.0,3.0
Aaliya Festive Full Sleeve Self Design Women's Top,"[""Clothing >> Women's Clothing >> Western Wear >> Shirts, Tops & Tunics >> Tops >> Aaliya Tops""]",1700.0,850.0,2.7
"Imported Banknote Tester, ball pen Permanent Alcohol Dye Base Marker","[""Pens & Stationery >> Office Supplies >> Sketch & Paint Markers >> Highlighter Pens >> Imported Highlighter Pens >> Imported Banknote Tester, ball pen Permanent Alc...""]",800.0,280.0,5.0
Autofurnish Car Cover For Santro Xing,"[""Automotive >> Accessories & Spare parts >> Car & Bike Care >> Car & Bike Covers >> Car Body Covers >> Autofurnish Car Cover For Santro Xing""]",1530.0,437.0,2.4
INDIANO Loafers,"[""Footwear >> Women's Footwear >> Casual Shoes >> Loafers >> INDIANO Loafers""]",1199.0,649.0,5.0
Rainfun Car Cover For 800,"[""Automotive >> Accessories & Spare parts >> Car & Bike Care >> Car & Bike Covers >> Car Body Covers >> Rainfun Car Cover For 800 (Without Mirror Pockets)""]",1799.0,599.0,3.3
Adidas Solid Men's Track Top,"[""Clothing >> Men's Clothing >> Sports Wear >> Track Tops >> Adidas Track Tops >> Adidas Solid Men's Track Top""]",2999.0,1949.0,1.0
Prime Printed 6 Seater Table Cover,"[""Home Furnishing >> Kitchen & Dining Linen >> Table Covers >> Prime Printed 6 Seater Table Cover (Multicolor, ...""]",1800.0,849.0,5.0
Prime Printed 8 Seater Table Cover,"[""Home Furnishing >> Kitchen & Dining Linen >> Table Covers >> Prime Printed 8 Seater Table Cover (Multicolor, ...""]",2000.0,899.0,5.0
Speedo Men's Swimsuit,"[""Clothing >> Men's Clothing >> Sports Wear >> Swimsuit & Swimwear >> Speedo Swimsuit & Swimwear >> Speedo Men's Swimsuit""]",699.0,699.0,4.0
Spangel Fashion Audi Style Alloy Mangalsutra,"[""Jewellery >> Mangalsutras & Tanmaniyas >> Spangel Fashion Audi Style Alloy Mangalsutra""]",1599.0,549.0,5.0
Mee Mee Women's Maternity Panty,"[""Clothing >> Women's Clothing >> Maternity Wear >> Lingerie & Sleepwear >> Panties >> Mee Mee Panties >> Mee Mee Women's Maternity Panty (Pack of 2)""]",358.0,358.0,1.0
knp enterprise Audi Style Alloy Mangalsutra,"[""Jewellery >> Mangalsutras & Tanmaniyas >> knp enterprise Audi Style Alloy Mangalsutra""]",1599.0,549.0,5.0
Asst Full Sleeve Solid Women's Jacket,"[""Clothing >> Women's Clothing >> Western Wear >> Shrugs & Jackets >> Winter Jackets >> Asst Winter Jackets""]",2299.0,1099.0,4.3
Purys Full Sleeve Solid Women's Fleece Jacket,"[""Clothing >> Women's Clothing >> Western Wear >> Shrugs & Jackets >> Winter Jackets >> Purys Winter Jackets""]",999.0,699.0,4.0
Sports 52 Wear Men's Cargos,"[""Clothing >> Men's Clothing >> Cargos, Shorts & 3/4ths >> Cargos >> Sports 52 Wear Cargos""]",2495.0,999.0,5.0
Silver Bucks Camouflage Cargo Men's Cargos,"[""Clothing >> Men's Clothing >> Cargos, Shorts & 3/4ths >> Cargos >> Silver Bucks Cargos""]",1695.0,1175.0,5.0
Basicare Loofah Sponge with Rope,"[""Beauty and Personal Care >> Bath and Spa >> Bath and Spa Accessories >> Loofahs >> Basicare Loofahs""]",185.0,185.0,3.2
Trufit Full Sleeve Solid Women's Bomber Jacket,"[""Clothing >> Women's Clothing >> Western Wear >> Shrugs & Jackets >> Winter Jackets >> Trufit Winter Jackets""]",2245.0,1345.0,5.0
SR Crafts Showpiece  -  15.24 cm,"[""Home Decor & Festive Needs >> Table Decor & Handicrafts >> Showpieces >> Human Figurines >> SR Crafts Human Figurines""]",1850.0,1399.0,5.0
Transcend MP 870 8 GB MP4 Player,"[""Computers >> Audio Players >> MP4 / Video MP3 Players >> Transcend MP4 / Video MP3 Players""]",4225.0,3450.0,3.8
Shop Rajasthan Abstract Single Dohar Multicolor,"[""Home Furnishing >> Bed Linen >> Blankets, Quilts & Dohars""]",1099.0,549.0,1.0
Clarks Olga Masie Women Flats,"[""Footwear >> Women's Footwear >> Flats""]",2799.0,1679.0,4.7
Clarks Shavi Loop Women Flats,"[""Footwear >> Women's Footwear >> Wedges""]",2799.0,1679.0,4.2
Elfani Brilliance Lip Color 127 Brick Red 3.5 g,"[""Beauty and Personal Care >> Makeup >> Lips >> Lipsticks >> Elfani Lipsticks""]",255.0,180.0,5.0
Perfect Women's Leggings,"[""Clothing >> Women's Clothing >> Ethnic Wear >> Ethnic Bottoms >> Leggings & Churidars >> Leggings & Jeggings >> Perfect Leggings & Jeggings >> Perfect Women's Leggings (Pack of 2)""]",998.0,598.0,5.0
Vaishna Fashion Women's Full Coverage Bra,"[""Clothing >> Women's Clothing >> Lingerie, Sleep & Swimwear >> Bras >> Vaishna Bras""]",210.0,94.0,3.0
Florentyne Padded Push-up Bra Women's Push-up Bra,"[""Clothing >> Women's Clothing >> Lingerie, Sleep & Swimwear >> Bras >> Florentyne Bras""]",850.0,399.0,5.0
Luxemburg Bandaeu Women's Tube Bra,"[""Clothing >> Women's Clothing >> Lingerie, Sleep & Swimwear >> Bras >> Luxemburg Bras""]",999.0,349.0,4.0
Laceandme Super Comfort Bandeau Women's Tube Bra,"[""Clothing >> Women's Clothing >> Lingerie, Sleep & Swimwear >> Bras >> Laceandme Bras""]",450.0,140.0,4.0
Ladyland Mybra Women's Full Coverage Bra,"[""Clothing >> Women's Clothing >> Lingerie, Sleep & Swimwear >> Bras >> Ladyland Bras""]",899.0,369.0,5.0
Secret Wish Cherry Print Navy Underwired Women's Full Coverage Bra,"[""Clothing >> Women's Clothing >> Lingerie, Sleep & Swimwear >> Bras >> Secret Wish Bras""]",1198.0,299.0,3.0
Ladyland Dia Beige Women's Full Coverage Bra,"[""Clothing >> Women's Clothing >> Lingerie, Sleep & Swimwear >> Bras >> Ladyland Bras""]",1499.0,529.0,5.0
Peri Peri Women's Push-up Bra,"[""Clothing >> Women's Clothing >> Lingerie, Sleep & Swimwear >> Bras >> Peri Peri Bras""]",999.0,349.0,3.2
Madaam NonPadded Women's Tube Bra,"[""Clothing >> Women's Clothing >> Lingerie, Sleep & Swimwear >> Bras >> Madaam Bras""]",367.0,127.0,1.0
Vivity Women's Full Coverage Bra,"[""Clothing >> Women's Clothing >> Lingerie, Sleep & Swimwear >> Bras >> Vivity Bras""]",1000.0,299.0,4.0
Ladyland Daisy Pink Women's Full Coverage Bra,"[""Clothing >> Women's Clothing >> Lingerie, Sleep & Swimwear >> Bras >> Ladyland Bras""]",729.0,319.0,5.0
Ladyland Liz Black Bra Women's Full Coverage Bra,"[""Clothing >> Women's Clothing >> Lingerie, Sleep & Swimwear >> Bras >> Ladyland Bras""]",1599.0,539.0,5.0
Ladyland Stellah Women's Full Coverage Bra,"[""Clothing >> Women's Clothing >> Lingerie, Sleep & Swimwear >> Bras >> Ladyland Bras""]",899.0,349.0,5.0
Urbaano Women's Full Coverage Bra,"[""Clothing >> Women's Clothing >> Lingerie, Sleep & Swimwear >> Bras >> Urbaano Bras""]",390.0,189.0,5.0
Oleva Women's Sports Bra,"[""Clothing >> Women's Clothing >> Lingerie, Sleep & Swimwear >> Bras >> Oleva Bras""]",599.0,130.0,1.0
Younky Fashion Women's Full Coverage Bra,"[""Clothing >> Women's Clothing >> Lingerie, Sleep & Swimwear >> Bras >> Younky Bras""]",1299.0,149.0,3.0
Luxemburg Women's Tube Bra,"[""Clothing >> Women's Clothing >> Lingerie, Sleep & Swimwear >> Bras >> Luxemburg Bras""]",649.0,249.0,3.5
Ladyland Life Women's Full Coverage Bra,"[""Clothing >> Women's Clothing >> Lingerie, Sleep & Swimwear >> Bras >> Ladyland Bras""]",849.0,349.0,5.0
Peri Peri Women's Bra,"[""Clothing >> Women's Clothing >> Lingerie, Sleep & Swimwear >> Bras >> Peri Peri Bras""]",1099.0,384.0,3.7
Vivity Women's Full Coverage Bra,"[""Clothing >> Women's Clothing >> Lingerie, Sleep & Swimwear >> Bras >> Vivity Bras""]",1000.0,299.0,2.3
Tia by Ten on Ten Fashion Women's Push-up Bra,"[""Clothing >> Women's Clothing >> Lingerie, Sleep & Swimwear >> Bras >> Tia by Ten on Ten Bras""]",1199.0,259.0,5.0
Grafion Comfortable Women's Full Coverage Bra,"[""Clothing >> Women's Clothing >> Lingerie, Sleep & Swimwear >> Bras >> Grafion Bras""]",499.0,129.0,5.0
Vaishna Fashion Women's Full Coverage Bra,"[""Clothing >> Women's Clothing >> Lingerie, Sleep & Swimwear >> Bras >> Vaishna Bras""]",230.0,99.0,5.0
Floret Women's Bra,"[""Clothing >> Women's Clothing >> Lingerie, Sleep & Swimwear >> Bras >> Floret Bras""]",189.0,179.0,2.0
Florentyne Padded Push-up Bra Women's Push-up Bra,"[""Clothing >> Women's Clothing >> Lingerie, Sleep & Swimwear >> Bras >> Florentyne Bras""]",850.0,399.0,5.0
Vivity KFB-24 Women's Plunge Bra,"[""Clothing >> Women's Clothing >> Lingerie, Sleep & Swimwear >> Bras >> Vivity Bras""]",1000.0,299.0,1.0
Urbaano Women's Full Coverage Bra,"[""Clothing >> Women's Clothing >> Lingerie, Sleep & Swimwear >> Bras >> Urbaano Bras""]",600.0,270.0,5.0
Luxemburg Women's Tube Bra,"[""Clothing >> Women's Clothing >> Lingerie, Sleep & Swimwear >> Bras >> Luxemburg Bras""]",649.0,249.0,2.0
PrettySecrets Fashion Women's Push-up Bra,"[""Clothing >> Women's Clothing >> Lingerie, Sleep & Swimwear >> Bras >> PrettySecrets Bras""]",899.0,899.0,1.0
Peri Peri Women's Bra,"[""Clothing >> Women's Clothing >> Lingerie, Sleep & Swimwear >> Bras >> Peri Peri Bras""]",1199.0,419.0,1.0
Florentyne Women's Full Coverage Bra,"[""Clothing >> Women's Clothing >> Lingerie, Sleep & Swimwear >> Bras >> Florentyne Bras""]",850.0,399.0,5.0
Florentyne Padded Push-up Bra Women's Push-up Bra,"[""Clothing >> Women's Clothing >> Lingerie, Sleep & Swimwear >> Bras >> Florentyne Bras""]",850.0,399.0,5.0
JSR Paris Beauty Pro Women's Full Coverage Bra,"[""Clothing >> Women's Clothing >> Lingerie, Sleep & Swimwear >> Bras >> JSR Paris Beauty Bras""]",499.0,214.0,5.0
Vivity Women's Plunge Bra,"[""Clothing >> Women's Clothing >> Lingerie, Sleep & Swimwear >> Bras >> Vivity Bras""]",1000.0,299.0,3.2
Triumph Form & Beauty 30 W Women's Bra,"[""Clothing >> Women's Clothing >> Lingerie, Sleep & Swimwear >> Bras >> Triumph Bras""]",899.0,899.0,5.0
Vivity Women's Plunge Bra,"[""Clothing >> Women's Clothing >> Lingerie, Sleep & Swimwear >> Bras >> Vivity Bras""]",1000.0,299.0,5.0
Grafion Comfortable Women's Full Coverage Bra,"[""Clothing >> Women's Clothing >> Lingerie, Sleep & Swimwear >> Bras >> Grafion Bras""]",499.0,79.0,2.0
Vivity Women's Plunge Bra,"[""Clothing >> Women's Clothing >> Lingerie, Sleep & Swimwear >> Bras >> Vivity Bras""]",1000.0,299.0,5.0
Florentyne Women's Full Coverage Bra,"[""Clothing >> Women's Clothing >> Lingerie, Sleep & Swimwear >> Bras >> Florentyne Bras""]",850.0,399.0,5.0
Hemali Pink Women's T-Shirt Bra,"[""Clothing >> Women's Clothing >> Lingerie, Sleep & Swimwear >> Bras >> Hemali Bras""]",1800.0,550.0,4.0
Vaishna Fashion Women's Full Coverage Bra,"[""Clothing >> Women's Clothing >> Lingerie, Sleep & Swimwear >> Bras >> Vaishna Bras""]",630.0,259.0,5.0
Tia by Ten on Ten Stripey Women's T-Shirt Bra,"[""Clothing >> Women's Clothing >> Lingerie, Sleep & Swimwear >> Bras >> Tia by Ten on Ten Bras""]",1199.0,255.0,1.0
Ladyland Comfy Beige Women's Full Coverage Bra,"[""Clothing >> Women's Clothing >> Lingerie, Sleep & Swimwear >> Bras >> Ladyland Bras""]",749.0,279.0,5.0
Luxemburg Strapless Bandaeu Women's Tube Bra,"[""Clothing >> Women's Clothing >> Lingerie, Sleep & Swimwear >> Bras >> Luxemburg Bras""]",799.0,299.0,5.0
Ladyland Jenifer Women's Full Coverage Bra,"[""Clothing >> Women's Clothing >> Lingerie, Sleep & Swimwear >> Bras >> Ladyland Bras""]",799.0,349.0,5.0
Ladyland Daisy Purple Women's Full Coverage Bra,"[""Clothing >> Women's Clothing >> Lingerie, Sleep & Swimwear >> Bras >> Ladyland Bras""]",729.0,249.0,5.0
Laceandme Super Comfort Women's Stick-on Bra,"[""Clothing >> Women's Clothing >> Lingerie, Sleep & Swimwear >> Bras >> Laceandme Bras""]",1250.0,579.0,1.0
Vivity Women's Plunge Bra,"[""Clothing >> Women's Clothing >> Lingerie, Sleep & Swimwear >> Bras >> Vivity Bras""]",1000.0,299.0,3.5
"PrettySecrets Women's T-Shirt, Push-up Bra","[""Clothing >> Women's Clothing >> Lingerie, Sleep & Swimwear >> Bras >> PrettySecrets Bras""]",899.0,899.0,3.8
Urbaano Women's Full Coverage Bra,"[""Clothing >> Women's Clothing >> Lingerie, Sleep & Swimwear >> Bras >> Urbaano Bras""]",1170.0,429.0,3.7
Grafion by Grafion - Comfort Feel Women's Tube Bra,"[""Clothing >> Women's Clothing >> Lingerie, Sleep & Swimwear >> Bras >> Grafion Bras""]",899.0,399.0,1.0
Leading Lady Women's Full Coverage Bra,"[""Clothing >> Women's Clothing >> Lingerie, Sleep & Swimwear >> Bras >> Leading Lady Bras""]",375.0,170.0,3.9
S4S Comfortable Women's Full Coverage Bra,"[""Clothing >> Women's Clothing >> Lingerie, Sleep & Swimwear >> Bras >> S4S Bras""]",499.0,122.0,5.0
Luxemburg Bandaeu Women's Tube Bra,"[""Clothing >> Women's Clothing >> Lingerie, Sleep & Swimwear >> Bras >> Luxemburg Bras""]",1299.0,499.0,4.0
Luxemburg Women's Tube Bra,"[""Clothing >> Women's Clothing >> Lingerie, Sleep & Swimwear >> Bras >> Luxemburg Bras""]",649.0,249.0,5.0
Vivity Women's Plunge Bra,"[""Clothing >> Women's Clothing >> Lingerie, Sleep & Swimwear >> Bras >> Vivity Bras""]",1000.0,299.0,4.0
Luxemburg Red Black and Pink Color Women's Tube Bra,"[""Clothing >> Women's Clothing >> Lingerie, Sleep & Swimwear >> Bras >> Luxemburg Bras""]",1299.0,499.0,3.0
Itsmuahlife by ItsMuahLife - Dazzle Women's Full Coverage Bra,"[""Clothing >> Women's Clothing >> Lingerie, Sleep & Swimwear >> Bras >> Itsmuahlife Bras""]",999.0,299.0,3.0
Ladyland Cozy White Women's Full Coverage Bra,"[""Clothing >> Women's Clothing >> Lingerie, Sleep & Swimwear >> Bras >> Ladyland Bras""]",799.0,349.0,5.0
Tia by Ten on Ten Fashion Women's Push-up Bra,"[""Clothing >> Women's Clothing >> Lingerie, Sleep & Swimwear >> Bras >> Tia by Ten on Ten Bras""]",1199.0,270.0,5.0
Younky Women's Sports Bra,"[""Clothing >> Women's Clothing >> Lingerie, Sleep & Swimwear >> Bras >> Younky Bras""]",999.0,199.0,1.0
JSR Paris Beauty Pro Women's Full Coverage Bra,"[""Clothing >> Women's Clothing >> Lingerie, Sleep & Swimwear >> Bras >> JSR Paris Beauty Bras""]",499.0,214.0,3.5
SK Dreams Fashion Women's Full Coverage Bra,"[""Clothing >> Women's Clothing >> Lingerie, Sleep & Swimwear >> Bras >> SK Dreams Bras""]",799.0,333.0,5.0
Q-rious Dzire Women's Full Coverage Bra,"[""Clothing >> Women's Clothing >> Lingerie, Sleep & Swimwear >> Bras >> Q-rious Bras""]",309.0,125.0,5.0
Wolfie LaceRed117 Women's Push-up Bra,"[""Clothing >> Women's Clothing >> Lingerie, Sleep & Swimwear >> Bras >> Wolfie Bras""]",1099.0,320.0,5.0
Younky Women's Sports Bra,"[""Clothing >> Women's Clothing >> Lingerie, Sleep & Swimwear >> Bras >> Younky Bras""]",999.0,199.0,4.0
Vivity Women's Plunge Bra,"[""Clothing >> Women's Clothing >> Lingerie, Sleep & Swimwear >> Bras >> Vivity Bras""]",1000.0,299.0,5.0
Wolfie Neonbrapeach101 Women's Push-up Bra,"[""Clothing >> Women's Clothing >> Lingerie, Sleep & Swimwear >> Bras >> Wolfie Bras""]",999.0,320.0,5.0
Younky Non_Padded Women's Full Coverage Bra,"[""Clothing >> Women's Clothing >> Lingerie, Sleep & Swimwear >> Bras >> Younky Bras""]",999.0,349.0,4.0
Tia by Ten on Ten Lacy Women's Push-up Bra,"[""Clothing >> Women's Clothing >> Lingerie, Sleep & Swimwear >> Bras >> Tia by Ten on Ten Bras""]",1199.0,255.0,1.0
Tia by Ten on Ten Velvetina Women's Push-up Bra,"[""Clothing >> Women's Clothing >> Lingerie, Sleep & Swimwear >> Bras >> Tia by Ten on Ten Bras""]",1199.0,500.0,5.0
Urbaano Bridal Bra Pack Women's Full Coverage Bra,"[""Clothing >> Women's Clothing >> Lingerie, Sleep & Swimwear >> Bras >> Urbaano Bras""]",1140.0,489.0,5.0
Ladyland Liz Women's Full Coverage Bra,"[""Clothing >> Women's Clothing >> Lingerie, Sleep & Swimwear >> Bras >> Ladyland Bras""]",799.0,339.0,5.0
Urbaano Women's Full Coverage Bra,"[""Clothing >> Women's Clothing >> Lingerie, Sleep & Swimwear >> Bras >> Urbaano Bras""]",900.0,399.0,5.0
Oleva Women's Full Coverage Bra,"[""Clothing >> Women's Clothing >> Lingerie, Sleep & Swimwear >> Bras >> Oleva Bras""]",599.0,99.0,2.3
PrettySecrets Fashion Women's Push-up Bra,"[""Clothing >> Women's Clothing >> Lingerie, Sleep & Swimwear >> Bras >> PrettySecrets Bras""]",899.0,809.0,5.0
Magiq Zuhi Women's Full Coverage Bra,"[""Clothing >> Women's Clothing >> Lingerie, Sleep & Swimwear >> Bras >> Magiq Bras""]",650.0,250.0,1.0
Oleva Women's Full Coverage Bra,"[""Clothing >> Women's Clothing >> Lingerie, Sleep & Swimwear >> Bras >> Oleva Bras""]",599.0,99.0,1.0
Q-rious Dzire Women's Full Coverage Bra,"[""Clothing >> Women's Clothing >> Lingerie, Sleep & Swimwear >> Bras >> Q-rious Bras""]",309.0,125.0,5.0
Florentyne Padded Push-up Bra Women's Push-up Bra,"[""Clothing >> Women's Clothing >> Lingerie, Sleep & Swimwear >> Bras >> Florentyne Bras""]",850.0,399.0,5.0
Hemali Green Women's T-Shirt Bra,"[""Clothing >> Women's Clothing >> Lingerie, Sleep & Swimwear >> Bras >> Hemali Bras""]",1200.0,399.0,4.0
Vivity Women's Plunge Bra,"[""Clothing >> Women's Clothing >> Lingerie, Sleep & Swimwear >> Bras >> Vivity Bras""]",1000.0,299.0,3.8
